{
  "template_id": "minimal_psych_explainer",
  "topic_name": "反刍思维",
  "platform": "YouTube",
  "orientation": "horizontal",
  "duration_sec": 38,
  "language": "zh-CN",
  "style_variant": "clean_white",
  "title": {
    "seriesLabel": "心理学中的反刍思维",
    "title": "心理学中的",
    "accent": "反刍思维",
    "footer": "轻心理知识分享"
  },
  "reelWords": [
    "反复回想",
    "停不下来",
    "内耗循环"
  ],
  "scenes": [
    {
      "header": "你不是不知道别想了",
      "zh": "为什么一件事已经过去了 / 你的脑子里却还在一遍遍 replay",
      "en": "Why does your mind keep replaying / something that already ended?",
      "icon": "replay",
      "bubble": "再想一遍"
    },
    {
      "header": "看起来像在分析",
      "zh": "你会不断回想一句话、一个表情、一次失误 / 像在脑海里反复倒带",
      "en": "You keep replaying a sentence, a look, or a mistake / as if your brain is constantly rewinding it.",
      "icon": "desk",
      "bubble": "我是不是说错了"
    },
    {
      "header": "其实还停在原地",
      "zh": "反刍更像一台跑步机 / 看起来在前进，实际上还停在原地",
      "en": "Rumination is more like a treadmill / it feels active, but you are still stuck in place.",
      "icon": "treadmill"
    },
    {
      "header": "越拉越紧",
      "zh": "你越想一次性把它想通 / 它反而会像绳结一样越拉越紧",
      "en": "The more you try to solve it in one go / the tighter it becomes, like a knot.",
      "icon": "knot"
    }
  ],
  "method": {
    "title": "打断反刍的 3 个更小动作",
    "zh": "不要要求自己一次想通 / 先让脑子离开循环，再回到现实",
    "en": "Do not force one perfect insight / first break the loop, then return to reality.",
    "steps": [
      {
        "label": "动作 1",
        "body": "先暂停追问为什么",
        "icon": "person"
      },
      {
        "label": "动作 2",
        "body": "把循环内容写下来",
        "icon": "write"
      },
      {
        "label": "动作 3",
        "body": "只做一个现实里的小动作",
        "icon": "step"
      }
    ]
  },
  "close": {
    "header": "不是逼自己立刻想明白",
    "zh": "当你不再逼自己立刻想明白 / 脑子反而会慢慢安静下来",
    "en": "When you stop forcing instant clarity / your mind can finally begin to settle.",
    "icon": "calm"
  },
  "voiceover_units": [
    {
      "id": "vo_01",
      "scene_id": "statement_1",
      "text": "为什么一件事已经过去了，你的脑子里却还在一遍遍 replay。",
      "target_duration_sec": 5.3,
      "intended_pause_after_sec": 0.15,
      "emphasis_words": [
        "replay"
      ],
      "timing_status": "aligned_from_current_audio"
    },
    {
      "id": "vo_02",
      "scene_id": "statement_2",
      "text": "你不是不知道别想了，而是总觉得，只要再想一会儿，就能把它想明白。",
      "target_duration_sec": 6.2,
      "intended_pause_after_sec": 0.15,
      "emphasis_words": [
        "想明白"
      ],
      "timing_status": "aligned_from_current_audio"
    },
    {
      "id": "vo_03",
      "scene_id": "statement_3",
      "text": "心理学里，这更像一种反刍思维。它看起来像分析，实际上却让你停在原地。",
      "target_duration_sec": 6.2,
      "intended_pause_after_sec": 0.15,
      "emphasis_words": [
        "反刍思维",
        "停在原地"
      ],
      "timing_status": "aligned_from_current_audio"
    },
    {
      "id": "vo_04",
      "scene_id": "statement_4",
      "text": "它也像一个越拉越紧的绳结。你越想一次解决，它反而越难松开。",
      "target_duration_sec": 6.2,
      "intended_pause_after_sec": 0.15,
      "emphasis_words": [
        "越拉越紧"
      ],
      "timing_status": "aligned_from_current_audio"
    },
    {
      "id": "vo_05",
      "scene_id": "method",
      "text": "想打断这种循环，不是逼自己立刻想通，而是先暂停追问为什么，把脑中的内容写下来，再做一个现实里的小动作。",
      "target_duration_sec": 8.8,
      "intended_pause_after_sec": 0.15,
      "emphasis_words": [
        "暂停",
        "写下来",
        "小动作"
      ],
      "timing_status": "aligned_from_current_audio"
    },
    {
      "id": "vo_06",
      "scene_id": "close",
      "text": "当你不再逼自己立刻想明白，脑子反而会慢慢安静下来。",
      "target_duration_sec": 5.3,
      "intended_pause_after_sec": 0,
      "emphasis_words": [
        "安静下来"
      ],
      "timing_status": "aligned_from_current_audio"
    }
  ],
  "audio_alignment": {
    "source_audio": "video-app/public/audio/minimal-psych/rumination-preview-voiceover.mp3",
    "measured_duration_sec": 37.87755102040816,
    "fps": 30,
    "composition_duration_frames": 1140,
    "alignment_method": "audio_duration_scaled_scene_timeline",
    "alignment_status": "preview_aligned"
  }
}
